{
  "active_phase": 1,
  "audit_candidate_commit": null,
  "bioinformatics_route": "conditionally_reopened",
  "claim_scope": "set_preservation_with_top1_retention",
  "contract_name": "biological_topk_candidate_site_v1",
  "contract_status": "in_validation",
  "epoch_id": "biological_topk_successor_v2",
  "final_decision": null,
  "final_decision_candidate": null,
  "fixed_total_artifact_storage_bytes": 68719476736,
  "gpu_screen_status": "experimental",
  "last_completed_phase": 0,
  "last_decision": "successor_phase_0_protocol_frozen",
  "phase_status": {
    "0": "pass",
    "1": "pending",
    "2": "pending",
    "3": "pending",
    "4": "pending",
    "5": "pending",
    "6": "pending",
    "7": "pending",
    "8": "pending",
    "9": "pending"
  },
  "predecessor_commit": "7fae3de6b13780d7cc0776038489cf2f22072339",
  "predecessor_decision": "blocked_fixed_budget",
  "previous_phase_commit": null,
  "program_name": "biological_topk_candidate_site_validation_successor",
  "program_schema_version": 1,
  "rank_order_claim": "diagnostic_only",
  "scientific_object": "clustered_TFO_query_target_candidate_site",
  "score_representation": "pending_phase1"
}
